{
  "as_of": "2026-07-29",
  "entries": [
    {
      "alternatives_considered": [
        "implicit filesystem discovery",
        "best-effort continuation"
      ],
      "authority": "TSIS_OWNER",
      "authorized_by_gate": "BT-GATE-001",
      "decision": "Resolve registered dataset, universe, price view and policies; reject any unresolved or unauthorized input.",
      "decision_id": "BT-DATA-001",
      "domain": "data_preflight",
      "evidence_class": [
        "EXPLICITLY_DOCUMENTED",
        "VERIFIED_IN_IMPLEMENTATION",
        "VERIFIED_BY_RUN"
      ],
      "policy_ids": [
        "BT-POL-DATA-001",
        "BT-POL-DATA-002",
        "BT-POL-DATA-003"
      ],
      "rationale": "A run must not consume unknown, unauthorized, unvalidated or physically inconsistent data.",
      "status": "ACTIVE",
      "supersedes": [],
      "title": "Fail closed before replay"
    },
    {
      "alternatives_considered": [
        "forward fill",
        "synthetic OHLC interpolation"
      ],
      "authority": "TSIS_OWNER",
      "authorized_by_gate": "BT-GATE-002",
      "decision": "Allow declared gaps under policy, emit gap evidence and never manufacture a bar.",
      "decision_id": "BT-DATA-002",
      "domain": "data_quality",
      "evidence_class": [
        "EXPLICITLY_DOCUMENTED",
        "VERIFIED_IN_IMPLEMENTATION"
      ],
      "policy_ids": [
        "BT-POL-DATA-004",
        "BT-POL-REPLAY-003"
      ],
      "rationale": "Invented bars would contaminate causality, availability and execution evidence.",
      "status": "ACTIVE",
      "supersedes": [],
      "title": "Preserve missing minutes without price imputation"
    },
    {
      "alternatives_considered": [
        "daily_adjusted",
        "split_normalized"
      ],
      "authority": "TSIS_OWNER",
      "authorized_by_gate": "BT-GATE-001",
      "decision": "Bind the bounded fixture to quote_guarded_1m and validate the binding before replay.",
      "decision_id": "BT-DATA-003",
      "domain": "price_view",
      "evidence_class": [
        "EXPLICITLY_DOCUMENTED",
        "VERIFIED_BY_RUN"
      ],
      "policy_ids": [
        "BT-POL-DATA-005"
      ],
      "rationale": "Execution proxies must not use daily-adjusted or split-normalized prices as fills.",
      "status": "ACTIVE",
      "supersedes": [],
      "title": "Use quote-guarded raw 1-minute view"
    },
    {
      "alternatives_considered": [
        "source row order",
        "bar start order only"
      ],
      "authority": "TSIS_OWNER",
      "authorized_by_gate": "BT-GATE-003",
      "decision": "Order replay deterministically by available_at and ticker, with gaps preceding bars on ties.",
      "decision_id": "BT-REPLAY-001",
      "domain": "replay",
      "evidence_class": [
        "EXPLICITLY_DOCUMENTED",
        "VERIFIED_IN_IMPLEMENTATION",
        "VERIFIED_BY_RUN"
      ],
      "policy_ids": [
        "BT-POL-REPLAY-001",
        "BT-POL-REPLAY-002"
      ],
      "rationale": "Event order must reflect when information became available and remain reproducible.",
      "status": "ACTIVE",
      "supersedes": [],
      "title": "Observable-at ordering"
    },
    {
      "alternatives_considered": [
        "optional hash verification"
      ],
      "authority": "TSIS_OWNER",
      "authorized_by_gate": "BT-GATE-003",
      "decision": "Source and preflight hashes are mandatory; mismatches fail closed.",
      "decision_id": "BT-REPLAY-002",
      "domain": "replay",
      "evidence_class": [
        "VERIFIED_IN_IMPLEMENTATION"
      ],
      "policy_ids": [
        "BT-POL-REPLAY-004"
      ],
      "rationale": "Replay must bind to the inspected bytes rather than a mutable path.",
      "status": "ACTIVE",
      "supersedes": [],
      "title": "Mandatory hash verification"
    },
    {
      "alternatives_considered": [
        "same-bar retrospective execution"
      ],
      "authority": "TSIS_OWNER",
      "authorized_by_gate": "BT-GATE-004",
      "decision": "Reject any decision not scheduled before its proxy execution timestamp.",
      "decision_id": "BT-MECH-001",
      "domain": "mechanics",
      "evidence_class": [
        "EXPLICITLY_DOCUMENTED",
        "VERIFIED_IN_IMPLEMENTATION"
      ],
      "policy_ids": [
        "BT-POL-MECH-001"
      ],
      "rationale": "A fill cannot be backdated to information that was not yet observable.",
      "status": "ACTIVE",
      "supersedes": [],
      "title": "Mechanical decisions are scheduled before proxy execution"
    },
    {
      "alternatives_considered": [
        "treat mechanical short fill as tradability proof"
      ],
      "authority": "TSIS_OWNER",
      "authorized_by_gate": "BT-GATE-004",
      "decision": "Permit short mechanics for engine validation while keeping tradability not evaluated.",
      "decision_id": "BT-MECH-002",
      "domain": "short_mechanics",
      "evidence_class": [
        "EXPLICITLY_DOCUMENTED"
      ],
      "policy_ids": [
        "BT-POL-SHORT-001"
      ],
      "rationale": "Correct short PnL arithmetic does not prove borrow availability or locate feasibility.",
      "status": "ACTIVE",
      "supersedes": [],
      "title": "Separate short mechanics from tradability"
    },
    {
      "alternatives_considered": [
        "summary-only PnL"
      ],
      "authority": "TSIS_OWNER",
      "authorized_by_gate": "BT-GATE-005",
      "decision": "Maintain separate cost components, cash ledger, account state and gross-to-net reconciliation.",
      "decision_id": "BT-ACCT-001",
      "domain": "accounting",
      "evidence_class": [
        "EXPLICITLY_DOCUMENTED",
        "VERIFIED_IN_IMPLEMENTATION",
        "VERIFIED_BY_RUN"
      ],
      "policy_ids": [
        "BT-POL-ACCT-001",
        "BT-POL-ACCT-002"
      ],
      "rationale": "Net results must reconcile from fill-level economic events rather than a manually asserted summary.",
      "status": "ACTIVE",
      "supersedes": [],
      "title": "Derive cash, costs and net PnL from fills"
    },
    {
      "alternatives_considered": [
        "round rates to cents at serialization"
      ],
      "authority": "TSIS_OWNER",
      "authorized_by_gate": "BT-GATE-005",
      "decision": "Serialize and calculate rates at sub-cent precision; round monetary postings only at the declared boundary.",
      "decision_id": "BT-ACCT-002",
      "domain": "precision",
      "evidence_class": [
        "EXPLICITLY_DOCUMENTED",
        "VERIFIED_IN_IMPLEMENTATION"
      ],
      "policy_ids": [
        "BT-POL-ACCT-003"
      ],
      "rationale": "Rounding a per-share rate before multiplication materially changes costs.",
      "status": "ACTIVE",
      "supersedes": [],
      "title": "Preserve sub-cent rates"
    },
    {
      "alternatives_considered": [
        "quote-aware profile as initial implementation"
      ],
      "authority": "TSIS_OWNER",
      "authorized_by_gate": "BT-GATE-006",
      "decision": "Use bar_based_execution_profile_v0_1; reserve quote-aware execution.",
      "decision_id": "BT-EXEC-001",
      "domain": "execution",
      "evidence_class": [
        "EXPLICITLY_DOCUMENTED"
      ],
      "policy_ids": [
        "BT-POL-EXEC-001"
      ],
      "rationale": "The bounded fixture guarantees bars, not quote-level execution semantics.",
      "status": "ACCEPTED_BY_BT_GATE_006",
      "supersedes": [],
      "title": "Primary V0.1 execution profile is bar based"
    },
    {
      "alternatives_considered": [
        "same-bar optimistic fills"
      ],
      "authority": "TSIS_OWNER",
      "authorized_by_gate": "BT-GATE-006",
      "decision": "The first eligible fill opportunity must occur after decision and submission under the contract timeline.",
      "decision_id": "BT-EXEC-002",
      "domain": "execution",
      "evidence_class": [
        "EXPLICITLY_DOCUMENTED"
      ],
      "policy_ids": [
        "BT-POL-EXEC-002"
      ],
      "rationale": "A bar used for a decision cannot also provide an earlier or simultaneous fill.",
      "status": "ACCEPTED_BY_BT_GATE_006",
      "supersedes": [],
      "title": "No same-bar lookahead"
    },
    {
      "alternatives_considered": [
        "apply generic adverse slippage to limits"
      ],
      "authority": "TSIS_OWNER",
      "authorized_by_gate": "BT-GATE-006",
      "decision": "Buy limits fill at or below the limit; sell limits fill at or above it; price improvement is disabled in V0.1.",
      "decision_id": "BT-EXEC-003",
      "domain": "execution",
      "evidence_class": [
        "EXPLICITLY_DOCUMENTED"
      ],
      "policy_ids": [
        "BT-POL-EXEC-003"
      ],
      "rationale": "Adverse slippage beyond a limit changes the order's economic meaning.",
      "status": "ACCEPTED_BY_BT_GATE_006",
      "supersedes": [],
      "title": "Limit protection cannot be violated"
    },
    {
      "alternatives_considered": [
        "always use stop price"
      ],
      "authority": "TSIS_OWNER",
      "authorized_by_gate": "BT-GATE-006",
      "decision": "Buy-side stop base is max(stop, open); sell-side stop base is min(stop, open), followed by adverse slippage.",
      "decision_id": "BT-EXEC-004",
      "domain": "execution",
      "evidence_class": [
        "EXPLICITLY_DOCUMENTED"
      ],
      "policy_ids": [
        "BT-POL-EXEC-004"
      ],
      "rationale": "Filling a crossed stop at the stop level is optimistic when the next bar opens through it.",
      "status": "ACCEPTED_BY_BT_GATE_006",
      "supersedes": [],
      "title": "Stop gap-through uses adverse open"
    },
    {
      "alternatives_considered": [
        "implement the full status vocabulary"
      ],
      "authority": "TSIS_OWNER",
      "authorized_by_gate": "BT-GATE-006",
      "decision": "V0.1 subset is MARKET_PROXY, LIMIT, STOP_MARKET_PROXY, FULL_FILL_ONLY and DAY; partial fills are reserved.",
      "decision_id": "BT-EXEC-005",
      "domain": "execution",
      "evidence_class": [
        "EXPLICITLY_DOCUMENTED"